{"metadata":{"documentType":"WORKOUT_DEFINITION","schemaVersion":3,"key":"LONG_RUN_STANDARD","version":4,"status":"PUBLISHED","contentHash":"e46eda5e5e7cfa8a4243d2c703b78a279586cd34dbf01ce3bc241f485cf03635"},"family":"LONG_RUN","eligiblePhases":["FOUNDATION","BUILD","RACE_SPECIFIC","TAPER"],"allowedPrescriptionModes":["DISTANCE"],"allowedDistanceAccountingModes":["EXACT_SESSION_TOTAL"]}