{
  "metadata": {
    "documentType": "WORKOUT_DEFINITION",
    "schemaVersion": 3,
    "key": "LONG_RUN_STANDARD",
    "version": 4,
    "status": "VALIDATED"
  },
  "family": "LONG_RUN",
  "eligiblePhases": ["FOUNDATION", "BUILD", "RACE_SPECIFIC", "TAPER"],
  "allowedPrescriptionModes": ["DISTANCE"],
  "allowedDistanceAccountingModes": ["EXACT_SESSION_TOTAL"]
}
