{"metadata":{"documentType":"WORKOUT_DEFINITION","schemaVersion":1,"key":"FARTLEK","version":2,"status":"PUBLISHED","contentHash":"6df78c0fd292791f0fd8ff149f6aba2d8765e0b1fbc6d9867d6832c0009f7c27"},"family":"QUALITY","complexityTier":1,"eligiblePhases":["BUILD"],"allowedPrescriptionModes":["MIXED"],"allowedDistanceAccountingModes":["ESTIMATED_SESSION_TOTAL"],"components":[{"sequenceOrder":1,"componentType":"WARM_UP","intensityDescriptor":"EASY"},{"sequenceOrder":2,"componentType":"MAIN_SET","intensityDescriptor":"SURGE_AND_FLOAT"},{"sequenceOrder":3,"componentType":"COOL_DOWN","intensityDescriptor":"EASY"}]}