{"metadata":{"documentType":"WORKOUT_DEFINITION","schemaVersion":3,"key":"EASY_STANDARD","version":4,"status":"PUBLISHED","contentHash":"19319e30efc4926df70adee30343f7acfbc5c7121d199f0581e56316aff384c6"},"family":"EASY","eligiblePhases":["FOUNDATION","BUILD","RACE_SPECIFIC","TAPER"],"allowedPrescriptionModes":["DISTANCE"],"allowedDistanceAccountingModes":["EXACT_SESSION_TOTAL"]}