{"metadata":{"documentType":"WORKOUT_DEFINITION","schemaVersion":1,"key":"EASY_STANDARD","version":1,"status":"PUBLISHED","contentHash":"8ddedec6ac61b25c1febdb6b1b839a045eb685a8c7a90558abea0c3d2029a3d1"},"family":"EASY","complexityTier":1,"eligiblePhases":["FOUNDATION","BUILD","RACE_SPECIFIC","TAPER"],"allowedPrescriptionModes":["DISTANCE"],"allowedDistanceAccountingModes":["EXACT_SESSION_TOTAL"],"components":[{"sequenceOrder":1,"componentType":"MAIN_SET","intensityDescriptor":"EASY"}]}