{"metadata":{"documentType":"WORKOUT_DEFINITION","schemaVersion":1,"key":"GOAL_PACE_TEN_K","version":2,"status":"PUBLISHED","contentHash":"722da8ef8b5da48cde7cb6817ee645686a60dd29015c5b88de2c8b1a87046726"},"family":"QUALITY","complexityTier":2,"eligiblePhases":["RACE_SPECIFIC"],"allowedPrescriptionModes":["PACE_BASED"],"components":[{"sequenceOrder":1,"componentType":"WARM_UP","intensityDescriptor":"EASY"},{"sequenceOrder":2,"componentType":"MAIN_SET","intensityDescriptor":"GOAL_PACE"},{"sequenceOrder":3,"componentType":"COOL_DOWN","intensityDescriptor":"EASY"}]}