{
  "metadata": {
    "documentType": "WORKOUT_DEFINITION",
    "schemaVersion": 1,
    "key": "LONG_RUN_STANDARD",
    "version": 2,
    "status": "VALIDATED"
  },
  "family": "LONG_RUN",
  "complexityTier": 1,
  "eligiblePhases": ["FOUNDATION", "BUILD", "RACE_SPECIFIC", "TAPER"],
  "allowedPrescriptionModes": ["DISTANCE"],
  "allowedDistanceAccountingModes": ["EXACT_SESSION_TOTAL"],
  "components": [
    { "sequenceOrder": 1, "componentType": "WARM_UP", "intensityDescriptor": "EASY" },
    { "sequenceOrder": 2, "componentType": "MAIN_SET", "intensityDescriptor": "STEADY" }
  ]
}
