{"metadata":{"documentType":"WORKOUT_DEFINITION","schemaVersion":1,"key":"LONG_RUN_STANDARD","version":1,"status":"PUBLISHED","contentHash":"92d43af58804bf4f77ec2d97b85a127780b5065557ef86ccc5dbf3265f315452"},"family":"LONG_RUN","complexityTier":1,"eligiblePhases":["FOUNDATION","BUILD","RACE_SPECIFIC","TAPER"],"allowedPrescriptionModes":["EFFORT_BASED"],"components":[{"sequenceOrder":1,"componentType":"WARM_UP","intensityDescriptor":"EASY"},{"sequenceOrder":2,"componentType":"MAIN_SET","intensityDescriptor":"STEADY"}]}