{
  "metadata": {
    "documentType": "WORKOUT_DEFINITION",
    "schemaVersion": 2,
    "key": "FARTLEK",
    "version": 3,
    "status": "DRAFT"
  },
  "family": "QUALITY",
  "complexityTier": 1,
  "eligiblePhases": ["BUILD"],
  "allowedPrescriptionModes": ["MIXED"],
  "allowedDistanceAccountingModes": ["ESTIMATED_SESSION_TOTAL"],
  "components": [
    { "sequenceOrder": 1, "componentType": "WARM_UP", "intensityDescriptor": "EASY" },
    { "sequenceOrder": 2, "componentType": "MAIN_SET", "intensityDescriptor": "SURGE_AND_FLOAT" },
    { "sequenceOrder": 3, "componentType": "RECOVERY", "intensityDescriptor": "EASY_JOG" },
    { "sequenceOrder": 4, "componentType": "COOL_DOWN", "intensityDescriptor": "EASY" }
  ]
}
