{"metadata":{"documentType":"WORKOUT_DEFINITION","schemaVersion":1,"key":"FARTLEK","version":1,"status":"PUBLISHED","contentHash":"8652ed9aa01a0909ab1efffdacf1e029a164bd5784b505351b7296d6a5f89482"},"family":"QUALITY","complexityTier":1,"eligiblePhases":["BUILD"],"allowedPrescriptionModes":["EFFORT_BASED"],"components":[{"sequenceOrder":1,"componentType":"WARM_UP","intensityDescriptor":"EASY"},{"sequenceOrder":2,"componentType":"MAIN_SET","intensityDescriptor":"SURGE_AND_FLOAT"},{"sequenceOrder":3,"componentType":"COOL_DOWN","intensityDescriptor":"EASY"}]}