{
  "metadata": {
    "documentType": "WORKOUT_DEFINITION",
    "schemaVersion": 3,
    "key": "THRESHOLD_TEMPO",
    "version": 5,
    "status": "DRAFT"
  },
  "family": "QUALITY",
  "eligiblePhases": ["BUILD", "RACE_SPECIFIC", "FOUNDATION"],
  "allowedPrescriptionModes": ["MIXED"],
  "allowedDistanceAccountingModes": ["ESTIMATED_SESSION_TOTAL"],
  "components": [
    { "sequenceOrder": 1, "componentType": "WARM_UP", "intensityDescriptor": "EASY" },
    { "sequenceOrder": 2, "componentType": "MAIN_SET", "intensityDescriptor": "THRESHOLD" },
    { "sequenceOrder": 3, "componentType": "COOL_DOWN", "intensityDescriptor": "EASY" }
  ]
}
