{"metadata":{"documentType":"WORKOUT_DEFINITION","schemaVersion":3,"key":"THRESHOLD_TEMPO","version":4,"status":"PUBLISHED","contentHash":"841f0584e83d31433eabb03acc9be494dab98b2735d31e23c7168300dea948c7"},"family":"QUALITY","eligiblePhases":["BUILD","RACE_SPECIFIC"],"allowedPrescriptionModes":["MIXED"],"allowedDistanceAccountingModes":["ESTIMATED_SESSION_TOTAL"],"components":[{"sequenceOrder":1,"componentType":"WARM_UP","intensityDescriptor":"EASY"},{"sequenceOrder":2,"componentType":"MAIN_SET","intensityDescriptor":"THRESHOLD"},{"sequenceOrder":3,"componentType":"COOL_DOWN","intensityDescriptor":"EASY"}]}