{
  "metadata": {
    "documentType": "WORKOUT_DEFINITION",
    "schemaVersion": 1,
    "key": "THRESHOLD_TEMPO",
    "version": 1,
    "status": "VALIDATED"
  },
  "family": "QUALITY",
  "complexityTier": 2,
  "eligiblePhases": ["BUILD", "RACE_SPECIFIC"],
  "allowedPrescriptionModes": ["PACE_BASED", "EFFORT_BASED"],
  "components": [
    { "sequenceOrder": 1, "componentType": "WARM_UP", "intensityDescriptor": "EASY" },
    { "sequenceOrder": 2, "componentType": "MAIN_SET", "intensityDescriptor": "THRESHOLD" },
    { "sequenceOrder": 3, "componentType": "COOL_DOWN", "intensityDescriptor": "EASY" }
  ]
}
