{
  "metadata": {
    "documentType": "WORKOUT_DEFINITION",
    "schemaVersion": 2,
    "key": "EASY_STANDARD",
    "version": 3,
    "status": "DRAFT"
  },
  "family": "EASY",
  "complexityTier": 1,
  "eligiblePhases": ["FOUNDATION", "BUILD", "RACE_SPECIFIC", "TAPER"],
  "allowedPrescriptionModes": ["DISTANCE"],
  "allowedDistanceAccountingModes": ["EXACT_SESSION_TOTAL"]
}
